{
  "incident_id": "11111111-1111-4111-8111-111111111111",
  "tenant_id": "22222222-2222-4222-8222-222222222222",
  "run_id": "33333333-3333-4333-8333-333333333333",
  "prompt": "Investigate the synthetic redacted latency signal.",
  "prompt_version": "prompt-incident-investigation-v1",
  "schema_version": "analysis-v1",
  "analysis_mode": "investigate",
  "context_refs": [
    {
      "evidence_id": "44444444-4444-4444-8444-444444444444",
      "digest": "sha256:aaaaaaaaaaaaaaaaaaaaaaaaaaaaaaaaaaaaaaaaaaaaaaaaaaaaaaaaaaaaaaaa",
      "source_type": "metric"
    }
  ],
  "data_classifications": ["redacted_metrics"],
  "purpose": "incident_investigation",
  "token_budget": 1000,
  "tool_budget": 2,
  "deadline_at": "2099-01-01T00:00:00Z"
}
